id,publish_date,title,Text,central body,political figure,affiliate,Mishka Stance
efe5f69c39ede3f0d017743e0d61e17f35ac22acb254f31299c91bbab2875bab,2024-03-20,BJP's TN Gameplan: Knock AIADMK Out Of The Ring,"This article was first published 1 year ago The BJP game-plan: Take the top slot, or a close second, either for the 'Lotus' or the larger NDA, if it can and push the AIADMK to the third place, explains N Sathiya Moorthy. IMAGE: Bharatiya Janata Party supremo Narendra Modi at an election meeting along with Tamil Nadu BJP chief K Annamalai, Pattali Makkal Katchi party founder Dr S Ramadoss, Union Minister L Murugan, TMC MP G K Vasan, former Tamil Nadu chief minister O Panneerselvam and other politicians in Salem, March 19, 2024. Photograph: ANI Photo For the Vanniar-strong Pattali Makkal Katchi with a committed five per cent vote-share since its inception way back in 1991 -- a rarity for a sub-regional party in Dravidian Tamil Nadu -- finalising the poll-pact with the ruling Bharatiya Janata Party at the Centre was a brain-racking affair by itself. But the worse may be yet to come, as the father-son leadership duo of PMK founder S Ramadoss and party president Anbumani Ramadoss may find it even more difficult to keep their flock together and ensure that they deliver the votes to the alliance as a whole -- and even more importantly, retain their",central government,"narendra modi, k annamalai, l murugan, o panneerselvam","bjp, nda, pattali makkal katchi",neutral
41c3031fb94d414f17a8a7663784723de88f4cdf2e9b2ea7ffb03fabc7617328,2024-05-05,Girish Kuber writes: Why Maharashtra worries the BJP,"If numbers tell a story, Maharashtra’s political landscape has thrown up an exciting one. Since the elections were announced, Prime Minister Narendra Modi has made a dozen visits to the state, and will likely make another half a dozen, if not more, till May 20 — the fifth and the last phase of polling in Maharashtra. Add to this an equal number of visits in the 12 months leading up to the election announcement. Yet, as the state’s third phase polling gets underway on May 7, Maharashtra remains as enigmatic as ever for the BJP. The gravity of the challenge in Maharashtra this time can be understood if seen in the light of the number of rallies — five — that the PM addressed in Maharashtra during the 2019 Lok Sabha elections. There seems to be such nervousness in the BJP that the PM, in a rare instance, has presented himself twice in one district. All these facts hint at one thing: The BJP leadership’s belief that the state could turn out to be its Achilles’ heel and that it is too important to be left for the local hotchpotch alliance to manage. This has resulted in the PM and",,narendra modi,bjp,pro
401eb2db96a21e431db062036a5817da5944f5e163c2f376588738f1a74a195e,2020-02-11,Arvind Kejriwal’s campaign does the trick for AAP,"In the end, Shaheen Bagh could not swing the Delhi Assembly elections for the BJP. Chief Minister Arvind Kejriwal and his campaign stressing the many achievements of his government did the trick for the Aam Aadmi Party (AAP). The loss in Delhi is a setback for Home Minister Amit Shah , who made it his mission to ensure that Mr. Kejriwal was denied a third term in office. Union Minister of State for Finance Anurag Thakur was banned from campaigning for 72 hours for raising the slogan of “death to traitors” on January 30, while he was earlier removed from the list of the BJP’s star campaigners. Mr. Shah repeatedly said Delhi’s voters should press the “lotus” button on the electronic voting machine so that the “current” was felt in Shaheen Bagh, where thousands of people are peacefully protesting against the CAA-NRC-NPR regime. Mr. Shah personally addressed 52 public meetings , road shows and street corner meetings, U.P. Chief Minister Yogi Adityanath addressed 12 public meetings in Delhi and Prime Minister Narendra Modi spoke at three public meetings, including one on Ramlila grounds. At one time, it appeared that the firing incidents in Jamia and the entry of masked hoodlums","ministry of finance, ministry of home affairs","amit shah, anurag thakur, yogi adityanath, narendra modi",bjp,neutral
970ece2512f576cdd91b572d8fb14fd2693668f88ed09899fa43a2449d666186,2024-06-09,"Salaam, Indian voters!","Published : Jun 09, 2024 13:36 IST - 6 MINS READ So much has already been said about the political outcome of Election 2024 in TV studios, newspaper columns, and stock markets and in conversations at homes, offices, and public spaces that it may seem that there is little to add. Yet, this election was so different from all previous elections, except the post-Emergency election of March 1977, that analysts, commentators, and historians will continue to discuss it for a long time to come. In 1977, the Emergency loomed large over the election, and one just did not know what the outcome would be. Therefore, the stunning defeat of Indira Gandhi’s party resulted in spontaneous jubilation. For the 2024 election, the spread of communal hatred, fear of intimidation, and pervasive state surveillance generated by the regime for its decade-long rule formed the context. From the hour the last EVM was sealed, exit polls on TV got busy in doling out the spectre of the return of an autocratic regime with unchecked power. But as the morning of June 4 progressed, and the election results started coming in, many voters heaved a sigh of relief, reminiscent of the 1977 results. Neither",,indira gandhi,,anti
7ef3bd23ad00581bacce558682290272f5e1a085271714198b19662a4824b060,2023-08-10,The calculus behind political neutrality,"What is the strategy of unaligned parties for the 2024 general election? While the “INDIA” alliance (or the Indian National Developmental Inclusive Alliance) has grabbed the headlines, the neutral camp that is sandwiched within the two big coalitions, subject to various push and pulls, provides an interesting portal to contemporary national politics. The neutral parties There are three major parties in this camp: the Biju Janata Dal (BJD), the Yuvajana Sramika Rythu Congress Party (YSRCP) and the Bharat Rashtra Samithi (BRS, earlier known as the Telangana Rashtra Samithi, or the TRS). The Bahujan Samaj Party is left out of the present analysis. These parties had racked up a combined 43 seats in 2019 (22 seats for the YSRCP, nine seats for the TRS, and 12 seats for the BJD), making this camp a crucial arbitrator of national fortunes. All three parties have largely followed the equidistant route since 2014 (except the TRS for a few years, although it seems back in the camp). We can make two broad comments on the stance of these neutral parties — both explain how these parties have a symbiotic relationship with the Bharatiya Janata Party (BJP) at the Centre. The first deals with a",central government,,bjp,neutral
fff8ad8570ff82ec9c67289663b4f39a311a3188518e0c12287108918404e13c,2023-02-20,Jana Sena's 2024 poll game plan will prove Pawan Kalyan’s political prowess,"Recently, ‘Power Star’ Pawan Kalyan announced that his Jana Sena Party (JSP) would contest seven to 14 Assembly seats in the 2024 Telangana elections and reiterated that he had the support of the BJP. However, he also asserted that Jana Sena’s role in Telangana politics would be limited given that his party plays a much stronger role in Andhra Pradesh (AP). Right now, the JSP is in alliance with the BJP in AP and Telangana, but the turning point for JSP would be if Pawan Kalyan decides to form an alliance with the Telugu Desam Party (TDP), led by N Chandrababu Naidu, ahead of the polls. The BJP, however, is clear that they do not want to partner with the TDP, which leaves the JSP in a fix. advertisement “The JSP will do whatever it promises, unlike the YSR Congress Party (YSRCP), which is being friendly with the Central government, but has apparently failed in getting what is legitimately due to Andhra Pradesh post-bifurcation. Jana Sena will do whatever it says, irrespective of who is its alliance partner,” Pawan Kalyan told media on January 25 at the time of conducting a pooja at the Kondagattu Sri Anjaneyaswamy temple for his",central government,,"jsp, bjp, tdp",neutral
cb295011fcb058a6b40dda55e1fec102063b9d494c48f09bec4831bd59e7fbe6,2018-07-26,Four years of Narendra Modi have not just failed India’s middle class but also the RSS,"But one of the government’s biggest, but least debated failures, is its inability to fulfil the aspirations of its ideological parent, the Rashtriya Swayamsewak Sangh (RSS). The organisation lent enormous support to the BJP before the 2014 Lok Sabha elections, not just to ensure a political victory for the party but also for itself to be strengthened. The unhappiness of traders, farmers, minorities, Dalits and the unemployed with Prime Minister Narendra Modi’s government and the Bharatiya Janata Party (BJP) president Amit Shah, have been discussed widely. The disappointment of the RSS goes beyond Article 370, Uniform Civil Code, Ram Mandir or the differences in economic policy, over which the RSS leaders have criticised BJP’s decisions several times. The real problem between the BJP and RSS is much deeper. When the BJP came to power in 2014 on the agenda of development, the RSS too pinned its hope on a progressive roadmap for safeguarding Hinduism. The issue of religious conversion is at the heart of the work that many of the RSS outfits engaged in. A major factor for religious conversions in tribal areas and the northeast is the quality service provided by Christian missionaries. RSS members have often said that",central government,"narendra modi, amit shah","rss,bjp",anti
ef28f0d44ed2070bfe6f0901604133a32a68e74645552292f63773d086e08af6,2024-03-28,"Letters to The Editor — March 28, 2024","Employment scenario The India Employment Report 2024 that says unemployment among youth has increased from around 35.2% in 2000 to 66% in 2024 reveals the hollow promises of all governments. Political leaders/parties have hoodwinked people especially the youth. The much-lauded programmes with fancy names that are often talked about by the government at the Centre have done very little in terms of creating employment opportunities. The youth of India should be alert and diligent in casting their votes in the general election. M.C. Vijay, Chennai As a professor teaching in a college in Thiruvananthapuram which offers 12 under-graduate and seven post-graduate courses in diverse subjects, I must confess that the number of students who would come to my office and offer sweets and seek one’s blessings after getting a job has drastically reduced. Another index of a decline in job openings in both the formal and informal sector is by just going through the daily newspapers on Wednesday. Till a few years ago, the advertisement for job vacancies covered about four to six pages, and sometimes these pages were detached and sold by newspaper vendors at a premium price, for which there was a mad scramble among job seekers. The",central government,,,neutral
d0e9a960676d30f960b8d52b7cde0d624ec2d8dc9b8730350cab91b33d2842a6,2024-10-14,What Congress Must Do To Win Maharashtra,"Convert the Haryana result into a blessing in disguise; make the calamity into an opportunity. Maharashtra was always the big ticket game in town; MVA must win it. The Congress should shift headquarters to Mumbai for the entire month. Show urgency and a hunger to win, asserts Sanjay Jha. IMAGE: Congress President Mallikarjun Kharge with Congress leader Rahul Gandhi at the party headquarters in New Delhi. Photograph: Rahul Singh/ANI Photo Dear @rahulgandhi @kharge @jairamramesh Sub: The Importance of winning Maharashtra and Jharkhand A quick feedback following the disappointing result in Haryana, albeit the formation of the NC-INC government in Jammu and Kashmir is a big victory. 1. Although tactically losing Haryana is a bad blow (mostly self-inflicted like Chhattisgarh, MP and earlier Punjab), you can take comfort from the following: a. The vote-shares are identical to the BJP. b. Congress vote share went up by 40% from 2019. Congress struggled with the last mile finish; a proverbial essay on several occasions. It is like being first in a 100m race, and then stumbling at the 95m mark. Sometimes losing, like winning, can become a habit. This needs to be reversed asap. You have barely a month to effect a transformation.",,,bjp,neutral
58ff2c8df21f03c8e3afc216110adf669b1f9e0814beedb8f2991e83b8a8cb9c,2023-08-11,No confidence motion on Manipur: Opposition’s missed opportunity,"Notwithstanding the Opposition’s exuberance over its new name, an early hope of defeating the Modi government simply on the back of a consolidated vote bank and a rickety bonhomie, the National Democratic Alliance (NDA) retains a distinct electoral edge in the run-up to the 2024 Lok Sabha polls. The recently concluded debate on and outcome of the no-confidence motion are a precise illustration of what ails their mission. The tragic events unfolding in Manipur presented a perfect opportunity to take the government to the mat. The no-confidence motion was, in theory, the right tactic to hold the treasury benches accountable but without a comprehensive strategy accompanying it, the ploy remained just that. The Opposition missed an opportunity to galvanise its ranks and catalyse its campaign because it proved incapable of planning a multifaceted strike on an emotive subject within and outside Parliament. Its unorganised, underprepared and uninformed approach has exposed its faultlines and projected that the promise of a united Opposition is riddled with impediments. Advertisement A variety of factors are likely to work against Indian National Developmental Inclusive Alliance’s (I-N-D-I-A) stated intent of dislodging the NDA government – the diversity of its constituents’ reasons to converge, a predilection to",,narendra modi,nda,neutral
38d6ea1e0b66efc013147c55d24a0f0b5d4c3140bcbe2b1b6a9fc024c8dd95bd,2024-05-31,Yogendra Yadav writes,"*Written by Yogendra Yadav This extraordinary election was an extraordinary personal journey for me. It has been a journey of loss and recovery of faith, a faith in democratic politics, a faith in the abstraction called The People. Advertisement In the last four decades of poll-watching, never before had I approached a national election with as much trepidation as in 2024. A few days after the announcement of elections a friend remarked: “Aap aaj kal mayoos se dikhte hain (you look despondent nowadays)”. He was right. While I wrote about how it was possible to bring the BJP below the 272 mark and planned with my Bharat Jodo Abhiyan colleagues to realise this possibility, I was not sure if it would happen. Media screens and middle class chatter was full of the pran pratishtha ceremony in Ayodhya. “400 paar” was being discussed as a prophecy with loyal channels drumming up figures up to 411. On the other side, the Opposition did not have a clear and shared narrative or a common programme, let alone a consensus leader to generate hope around an alternative. I began asking myself: Is this the end of the India we grew up in? Have words",,,bjp,neutral
33b74a7cdf88b282d38477f96a756a1a128430c1589fc087dc2e7e3b9fc9cc62,2024-06-15,Why the exit polls couldn’t get the nation’s pulse in 2024,"The recently concluded Indian elections to the Lok Sabha threw up many surprises. Arguably, the biggest surprise was the difference between the actual results and the forecasts made by almost all national exit polls just three days earlier. Several of these exit polls forecast that the National Democratic Alliance (NDA) would get more than 360 out of the 543 seats with three of them, forecasting an upper range exceeding 400 seats for the NDA. All these polls also forecast that the Bharatiya Janata Party (BJP), the biggest constituent of the NDA, would significantly improve upon its 2019 tally of 303 seats. As it was, the NDA ended with 293 while the BJP got 240 seats thereby losing its individual majority in the Lok Sabha. Why did the national pollsters get it so wrong? Even more importantly, why was there such unanimity amongst the pollsters? The conspiracy theorists have naturally had a field day with explanations ranging from malafide motivations to all pollsters using the same sample and other, even wilder, conjectures. Advertisement There may, however, be a more benign explanation for both the similarity of the projections and the big errors. Forecasting seats using exit polls of a random sample",,,"nda, bjp",neutral
25e20a908795e0a09d0f6a2f3d58436df9ec7c352f7566713544cff9cf49e0c0,2023-12-10,From the Opinions Editor: Assembly election results and the big question for 2024,"There is enough evidence to show that voter behaviour during state elections is not always similar to the choices people make in general elections. However, with the Lok Sabha polls barely a few months ago, it was perhaps inevitable that the recently declared assembly election results would prompt conversations on the direction of the electoral winds in 2024. The BJP’s emphatic victories in Rajasthan, Madhya Pradesh and Chhattisgarh have led to a search for patterns in the country’s polity post-2024. The Congress now heads governments in only three states. A consolation victory in Telangana notwithstanding, questions are being raised about its ability to lead the opposition bloc. A related question pertains to the viability of the Opposition itself. Is 2024 a foregone conclusion? In a debate in this newspaper, two experts had divergent views. Psephologist Pradeep Gupta contended that India, is in the throes of a “pro-incumbency wave, unprecedented in the country’s history”. “The BJP’s phenomenal victory in Madhya Pradesh, Rajasthan and Chhattisgarh as well as the surge in Telangana has once again demonstrated the unparalleled connect Prime Minister Modi has with the people of the nation — a bond which transcends geographies, caste, creed, community, language and gender” he",,narendra modi,bjp,neutral
629bdcb27165934dbbfce59e7959e0f04715717d9b2507b8be228368a3b30ec7,2024-11-26,Elections Round-up: BJP Dominant but Opposition Must Not Roll Over and Die,"As for the Congress, the results present a mixed bag. There was good news from the South, with Priyanka Gandhi's massive victory in her debut to the Lok Sabha from Wayanad in Kerala, a contest that she won by a record margin of more than 4,00,000 votes. Again, it showed that the BJP has failed to make much headway even against the Congress when faced with strong local leaders, like Karnataka CM Siddaramaiah and DK Shivakumar, and in Kerala, where it is unable to cross the political firewall created by the United Democratic Front and Left Democratic Front. In Rajasthan, however, the Congress was humiliated, finishing third in as many as four constituencies, allowing the BJP to win five out of the seven assembly bypolls. The party also lost in the sole assembly bypoll in Chhattisgarh but put up a slightly better fight in Madhya Pradesh where it defeated a BJP cabinet minister, and significantly reduced the victory margin of the BJP candidate standing from former CM Shivraj Singh Chauhan’s constituency. For Prime Minister Modi and the BJP, with the NDA winning not just the prestigious state of Maharashtra but also bagging 26 out of the 46 assembly bypolls, along",,narendra modi,"bjp,nda",neutral
2cee4a8fcd4c260b4d3bb6ea91adeb779eb1b8c4cb869c7f6e2ce68c7d1e1cb9,2024-06-13,Andhra Pradesh’s new cabinet does not reflect the diverse groups that voted TDP-JSP-BJP to power,"The alliance of the Telugu Desam Party (TDP), Bharatiya Janata Party (BJP) and Jana Sena Party (JSP) defeated YS Jagan Mohan Reddy’s Yuvajana Sramika Rythu Congress Party (YSRCP) in the assembly election of 2024 by a margin of 15.91 per cent vote share. The alliance has now formed the government, which N Chandrababu Naidu heads as the fourth-time chief minister of composite and residual Andhra Pradesh (AP). In the 2024 election, the alliance won 164 assembly and 21 Lok Sabha seats with a vote share of 53.48 per cent and the YSRCP has been reduced to 11 assembly and four Lok Sabha seats with a vote share of 39.37 per cent due to its failure in fulfilling the electoral promises. Advertisement In the 2019 election, the YSRCP secured 151 assembly seats with 50 per cent vote share by promising the Special Category Status (SCS) for the state and the Navaratnalu (nine jewels) welfare schemes. The SCS was promised on the floor of Parliament at the time of AP’s bifurcation in 2014. The YSRCP promised to relentlessly pursue this promise. Within a short time, however, the promise was set aside and the state entered a deep financial crisis. Another promise made",,n chandrababu naidu,"bjp, jsp",neutral
6d6b49dfcf0098e0c27b2ba7ad91934cad0d67ac15b0c98697a8063cec11506b,2021-05-13,What post-poll violence tells us about politics in Bengal,"The magnitude and brutality of the post-poll violence in West Bengal is an indicator of the extent of partisan polarisation, so much so that rivals are considered enemies. However, it would be inappropriate to describe the premeditated incidents merely as a collapse of law and order or a result of localised political rivalries. They are symptoms of a decline of democracy: Such incidents, which carry political patronage, betray the principles as well as conventions of Indian democracy. Political parties give legitimacy to each other and rightly assume that the circulation of leaders and parties is inevitable in a vibrant Indian society. Jawaharlal Nehru’s compliment to Atal Bihari Vajpayee can be cited in this regard. Nehru predicted Vajpayee would one day become Prime Minister, despite his explicit abhorrence of the latter’s ideology. Moreover, there was a huge gap between Nehru’s Congress and Vajpayee’s Bhartiya Jana Sangh (BJS) in terms of vote shares in the 1957 Lok Sabha elections. The Congress and BJS secured, respectively, 47.8 per cent votes and 371 seats and 5.98 per cent votes and four seats. The contestations and confrontations based on mutual legitimacy strengthen democracy. They provide courage to the smallest party and individual leader to oppose",,"atal bihari vajpayee, jawaharlal nehru",bhartiya jana sangh,neutral
36010f81a36b3b5adc3f9d16b2c139e3616ed3fd6ea50866fc8a5b8cae194602,2019-07-10,Why DK Shivakumar is the Congress's last resort,"It’s a pun that’s been doing the political circles for some time now. DK Shivakumar is Congress’s last resort’. In the cess pit that is Indian politics the term horse trading’ is frequently used. And in this world where MLAs are frequently herded into resorts to shield them from poaching, Shivakumar is looked up in awe, a regent of resort politics. advertisement Who is Doddalahalli Kempegowda Shivakumar, 57, who wanted to have coffee with colleagues but was stopped by the Mumbai Police from doing so? For good reasons he is known as the Congress’s troubleshooter, even a kotwal (sentinel). He has taken on Bharatiya Janata Party’s master strategist Amit Shah twice in the recent past and come out trumps. Rewind to May 2018 after the Karnataka assembly results were declared. In the 225-member assembly BJP was the single-largest party with 105 MLAs. Congress won 79 and Janata Dal (Secular) 37. Corralling colleagues Grabbing the opportunity Congress inked an alliance with JD (S) to keep BJP from grabbing power. The man chosen to keep the alliance flock together was DK Shivakumar. Not only did he keep a strict eye on the alliance lawmakers -- media reports say he did not even",,amit shah,bjp,neutral
44943c96f3a2929e129e9c1102e1ed71d6138a2fecf5482b7db886ae28320f9d,2025-05-28,"A dissenting daughter, a leaked letter and a divided house in BRS","Written by K Nageshwar K Kavitha’s letter to her father and BRS (Bharat Rashtra Samithi) supremo K Chandrashekhar Rao (KCR) has triggered a political flutter. Speculation is rife about the future course of events in the pink party and its first family. Advertisement Kavitha, who is currently an MLC and a former MP, raised a variety of issues in her six-page letter, ranging from KCR’s style of functioning and organisational lapses to what she considered shortcomings in the party’s political positions. Her remark that the BRS’s soft approach to the BJP has sent wrong signals led to rumours that they could go for an alliance in the future. She was referring to KCR attacking the BJP for only about two minutes during BRS’s silver jubilee plenary, while his entire tirade focused on Congress rule. BRS leaders, however, refute Kavitha’s charges. Speaking to this author, BRS MLC Dasoju Sravan Kumar said that KCR has his own style of public communication, and in the recently held Warangal meet, he wanted to send a message that he is battle-ready. Notwithstanding such a defence, KCR certainly demonstrated a soft approach towards the BJP — an allegation his daughter rightly pointed out. Indeed, the BRS",,,bjp,neutral
