id,publish_date,title,Text,central body,political figure,affiliate,Mishka Stance
50910bb9145f826bd2786e27f969c6576494dd21d068268736cd79fc2175daa2,2019-10-21,Now is the time for the Congress to campaign on NYAY,"India’s slowdown is arguably the biggest economic crisis since 1991. Lakhs of people have lost their jobs, incomes and wages are stagnating, not leaving people with enough money even to buy essentials like underwear and biscuits. The winter of 2019, even more than the summer of 2019, is ripe for a real NYAY campaign. As PM Narendra Modi claims all is well and India is on its way to becoming a $5-trillion economy, the Congress and the opposition at large could throw him a simple challenge: universal basic income. The challenge could be refined further: give either a job or minimum basic income to every family. ‘Naukri ya NYAY’. If India is doing as well as Modi claims, no Indian family should be earning less than Rs 6,000 a month. And if one is, then the government should step in with help. There will be many benefits of a NYAY campaign, if undertaken today. Also read: If anything can defeat Modi, it’s the economy The upper hand First, it will help the opposition set the agenda. Mostly it is the Modi government that gets to set the agenda and the opposition only reacts. What the opposition has to say becomes",central government,narendra modi,,anti
22a3cff6d8bc0a9cd75edf48823218a439041f70626836ed7dd2c1a40bc1b698,2024-04-01,Lok Sabha Elections 2024: A Tale Of 'Friendly Contests,"With only days to go before the commencement of the 2024 Lok Sabha elections, it seems increasingly likely that many alliance partners will field candidates against each other. In West Bengal, for example, the INDIA bloc, presumed to be intact elsewhere, has disintegrated completely. Chief Minister Mamata Banerjee's All India Trinamool Congress (TMC) has put forth candidates in all 42 Lok Sabha seats in the state. Banerjee has boldly challenged the Congress stronghold of Baharampur, currently represented by Congress leader Adhir Ranjan Chowdhury, by nominating former cricketer Yusuf Pathan. This strategic move is believed to be calculated, considering the significant Muslim population in the area. Even the anti-TMC, anti-Bharatiya Janata Party (BJP) front comprising the Congress, the Left parties, and the Indian Secular Front (ISF) is currently negotiating to avoid ""friendly contests"" in some constituencies. Bihar's Mahagathbandhan; INDIA In Kerala In neighbouring Bihar, the Mahagathbandhan (Grand Alliance) of the Rashtriya Janata Dal (RJD), the Congress, and the Left are engaged in last-minute discussions to avert a similar situation. Their coalition in the 2020 assembly elections proved fruitful, except for the Congress, which fared poorly. The Grand Alliance, consisting of various parties, including the RJD, the Congress, the Communist Party of",,,bjp,neutral
b3a47b0bedec60a579c8b6573758523da07047d3ac84d4d1a0136c5af640c881,2019-12-06,Do government’s welfare schemes influence the patterns of voting?,"Despite its initial inclination to treat welfare schemes as old-fashioned instances of “vote bank politics”, welfare has become a priority of sorts for the Bharatiya Janata Party (BJP) under Narendra Modi. In its first term, the Modi government launched a number of flagship welfare schemes (such as the Ujjwala Yojana, Jan Dhan Yojana and Ayushman Bharat) and rebranded others. These schemes were also integrated with Aadhaar. Our findings suggest that there are some important patterns emerging in the electoral politics of welfare which are likely to shape policy design and implementation in the future(Diwakar Prasad/ Hindustan Times) In the run-up to the 2019 elections, the central government launched a new cash transfer directed at farmers — PM-Kisan — in response to rising agrarian distress. The pledge to introduce a basic income scheme (NYAY) became a central pledge in the Congress manifesto. We know relatively little about whether such existing and promised schemes made a difference to people’s voting decisions. While the Pulwama attack and its response helped to dislodge questions of rural distress from the centre of the election agenda, media reporting suggested that the BJP’s party workers made a concerted effort to reach out to beneficiaries from different schemes",central government,narendra modi,bjp,pro
b78427450ae5dec09a253622ff9a5608aca1746bec5fbfbf791e511fa49fce7a,2020-02-12,Message from Delhi election results: Public hai sab jaanti hai,"When asked to respond to Delhi Assembly election results, Bihar Chief Minister and Janata Dal United president Nitish Kumar said, ""Janata maalik hai (public is the lord)."" Nitish Kumar's JDU failed to win a single seat in Delhi election that it fought in alliance with its senior NDA partner, the BJP. The two parties will be facing public later this year when Nitish Kumar will seek yet another term as Bihar CM. advertisement The ""janata maalik hai"" remark appeared to be at variance with the narrative that the nation is in the grip of a Modi wave, as the BJP continues to assert in victory and in defeats. The ""janata maalik hai"" presents the voters and people of the country as wise women who make informed choices in elections. The wave theory on the other hand conveys that the janata is under the influence of some spell of magic. Delhi Assembly election fits in the assessment that gives the devil - the janata - its due. Appearance of Narendra Modi on the national scene and 2019 Lok Sabha election marked the beginning of a new phase of politics and electioneering in India. People voted a single-party majority government at the",,narendra modi,"nda,bjp",pro
c161ef46d10b22adb503a76c51b9e1afe540306138a436be048dc5f62f001522,2024-05-22,Vote for a change: On the voter in Kashmir,"The voter turnout in the Srinagar and Baramulla constituencies in the Kashmir valley — Anantnag-Rajouri is to vote on May 25 after the Election Commission of India postponed the election — is well below the national average. While Srinagar registered only 38.5%, preliminary figures from Baramulla indicate a turnout of 59.1%. The national average for the first four phases was 66.95% and 61.61% in the fifth phase, according to early trends. Yet, these numbers in the Valley are salubrious compared to the past — 13% in Srinagar and 34.6% in Baramulla in 2019. Baramulla registered its highest turnout since 1984 (61.1% participation). In the last six years, the elected Assembly was dissolved, the erstwhile State of Jammu and Kashmir bifurcated into two Union Territories, the special status of the province abrogated by the BJP-led Union government, and the Valley subjected to months of Internet shutdowns. Scores of politicians were also arrested. Kashmir still remains India’s most securitised region with recurring militant violence. While local body elections have been held since then, the general election is the first major poll with significant contestation involving the Valley’s mainstream polity. Should the increase in turnout be read as a significant reduction in the",central government,,bjp,neutral
eed7e209f7ab09df52d3e1a1e908458e49e3ecfbf369b799ffb62c8948dc8e10,2024-06-21,How CPI(M) Became A Victim Of Its Own Propaganda In Kerala,"Beyond the Bharatiya Janata Party (BJP) opening its Lok Sabha account in Kerala through Suresh Gopi, the Left's rout in the general election warrants a closer analysis. Anti-incumbency – although it did play a part – wasn't the only factor. There was a larger undercurrent that became evident after the Lok Sabha election results. The Left Democratic Front (LDF), led by the Communist Party of India (Marxist) (CPI-M), has been reduced to a third of the total vote share at 33.3%. It lost an additional two percentage points since 2019 despite an alliance with the Church-backed Kerala Congress (M) and the Socialists. The National Democratic Alliance's (NDA) vote share, in contrast, climbed to a staggering 19.2%. While the Congress-led United Democratic Front (UDF) also lost two percentage points and got just about 45% votes, it has retained the support of Muslims and Christians. It's the LDF that's in serious need of introspection. How CPI(M) Became A ‘Hindu Party' It needs to be understood that the CPI(M) has long been considered Kerala's ‘Hindu party'. This has been the case since the time the undivided Communist Party came to power in the first assembly election in 1957, soon after the Kerala Renaissance",,,"bjp, nda",neutral
19a673ec9c5e1eb30bf1df052701a0e563352a5c2b9bfc761d70dd42b05eb38e,2019-08-05,"Amit Shah sends Articles 370, 35A and statehood to the history bin without asking J&K its opinion","Jiby writes on politics, governance and legal affairs, and enjoys hunting for data to make his arguments. He was a leader writer in the Edit Page team at The Times of India between July 2017 and January 2023 LESS ... MORE A presidential notification, two house resolutions, and a reorganisation bill: and lo and behold, Articles 370 and 35A ceased to operate, and the state of Jammu and Kashmir was downgraded to a union territory. August 5 marks a watershed moment for Independent India history and the Constitution of India. In one massive strike, or a magical sleight of hand, call it what you may, Modi government implemented its 2019 manifesto promises on 370 that had powered it past the 300 mark in the Lok Sabha. Unfortunately, in the process government also took liberties with the Constitution, undermined federalism, and punctured the premise of autonomy in the Indian Republic under which successive generations of Kashmir politicians swore their loyalty to India. Kashmir is bound to pass through very trying times in the days ahead. The presidential notification invoked Article 370(1) to create a 2019 Constitution Order to supercede a 1954 “Constitution Order” issued by then President Rajendra Prasad that had",central government,,,anti
118b05a366a73dcde075824428435be3a6a9dab37d65c0f0ce5de9875a263cca,2022-02-03,Turmeric woes in Telangana,"Nizamabad MP Dharmapuri Arvind, who belongs to the Bharatiya Janata Party, chose a novel way of making his pre-election promises before the 2019 general election. Unlike other candidates who make promises in manifestos or at rallies, Mr. Arvind made them on stamp paper, mostly in vogue at the village level in Telangana and Andhra Pradesh. He won the election. Last week, Mr. Arvind’s convoy was obstructed by turmeric farmers, whom he later called TRS (Telangana Rashtra Samithi) activists, when he was on a visit to Nandipet mandal. Mr. Arvind alleged that disguising themselves as turmeric farmers, TRS activists had attacked him and damaged his vehicle as the police “played spectators”. Nearly three years after the novel way in which he made his poll promises, Mr. Arvind has not been able to give a reason for his inability to fulfil two of his promises: one of getting a Turmeric Board sanctioned to Nizamabad and the other of getting a minimum support price fixed for turmeric and red jowar, both of which are grown extensively in his parliamentary constituency. He had also said in 2019 that he would quit as MP and join the farmers’/ people’s movement if he fails to keep",,dharmapuri arvind,bjp,neutral
91e7af5150cc539c9c14138df9b10160fba6cb6f8082c64566414b2130148b09,2022-09-08,Fissures in Opposition derailing Nitish Kumar’s Delhi dream,"Like a marathon runner, Nitish Kumar has been phasing his run for Delhi. There has been no Usain Bolt-like dash to the finishing tape but a visible increase in “cadence”- the number of steps one takes in a minute of running. But there is also a huge degree of predictability in what Nitish is doing or how he is doing it. The NDA would have never chosen him as its PM candidate. For the Opposition, he would have remained a political untouchable as long as he stayed in power with the BJP’s support. advertisement By dumping and hurting the BJP in Bihar, he made himself “acceptable” to the spectrum of Opposition parties and thus “eligible” for a national role. To officially signal that he is “available” to be “chosen” by the Opposition, Nitish arrived in India’s political hotspot - Delhi - on Monday. In the last three days, his ideological flexibility was on display. With handshakes, hugs and nostalgic rewinds to his old associations with Opposition parties and leaders, he plugged himself back into the Opposition system and went for a reboot. It was easy as the fragmented opposition needs a positive unity narrative. He had high-profile meetings with Rahul",,nitish kumar,bjp,neutral
9fb12f160c51a693a91b1832666eadeaba77165412863925836e5ca3f644e265,2023-12-11,Rebellions by popular BJP leaders have proved mutually injurious,"Amid a whiff of assertion to the chief minister’s chair by regional party satraps of BJP in Rajasthan and Madhya Pradesh, it is pertinent to look at how rebellions by popular leaders of the party played out in the past. Prominent among the names who walked out of the party are Kalyan Singh, Uma Bharati and BS Yeddyurappa . While they regretted their decision later on, the party also suffered electorally.Though the process of appointing Vishnu Deo Sai as chief minister in Chhattisgarh was smooth as Raman Singh , who was touted by some as a claimant to the post as he had served as CM for 15 years, himself willingly performed the role of announcing Sai’s name. He had not fallen out of line even when the party high command had decided not to field his son in the 2019 Lok Sabha polls. However, in Rajasthan and Madhya Pradesh some dissenting voices may be heard. Vasundhara Raje , who has served as chief minister of Rajasthan twice in the past, met over 45 newly elected BJP MLAs at her residence last Tuesday. These lawmakers expressed their support to her for the CM post even as the party high command",,"kalyan singh, uma bharati, bs yeddyurappa, vishnu deo sai, raman singh, vasundhara raje",bjp,neutral
cb12f303e3a0d36899cd806604203234f0f0473e688747484efed15fa992deb4,2022-03-22,How Modi-Shah Can Be Beaten,"This article was first published 3 years ago To beat BJP, you either deny them a critical mass of Hindu vote or build a regional leader and party strong enough to protect their turf, observes Shekhar Gupta. IMAGE: Bharatiya Janata Party supremo and Prime Minister Narendra Damodardas Modi being garlanded by BJP National President Jagat Prakash Nadda, Home Minister Amit Anilchandra Shah, Defence Minister Rajnath Singh and Road Transport and Highways Minister Nitin Gadkari following the party's triumph in assembly elections in Uttar Pradesh, Manipur, Uttarakhand and Goa, March 10, 2022. Photograph: Rahul Singh/ANI Photo The BJP, since its rise under Narendra Modi and Amit Shah, has been an election-winning cavalry. But it has also lost some. With its sweep in Uttar Pradesh and three other states now, the air is overloaded with gyan from the entire pundit class on why and how the BJP wins. It is important, and interesting therefore, to step away and examine when, how and why it loses. And lose it does. If in any doubt, check out how much of India the BJP controlled at its peak in early 2018, 2019, and now. In terms of area, it is now about 44 per cent,",,"narendra modi, amit shah, rajnath singh, nitin gadkari",bjp,pro
636f18fb9de8de268993defd72b646555efd96aa07f3975c8bd6024b201a778b,2020-08-24,"No rallies or roadshows, Bihar digital election is on WhatsApp, Facebook — BJP’s home turf","As politics become more about the dazzle of personality and imagery, and the shrillness of emotion, the BJP looks set to continue capturing the mind-space of Indian voters. Bihar will be the next testing ground to gauge the extent of this capture. In June this year, nine opposition parties had petitioned the EC against the Bharatiya Janata Party (BJP)’s digital campaign in Bihar, claiming that it disturbed the level-playing field. The opposition’s concern is based on good reason, because the digital turn in politics brings four distinct and critical advantages for the BJP going into the Bihar election. The 2020 Bihar assembly election marks the beginning of an era in which digital campaigns will become central to Indian elections. With stringent guidelines issued by the Election Commission of India in light of the coronavirus pandemic, physical campaigning will have a limited impact in swinging the electoral outcome. Only groups of up to five people are allowed to campaign door-to-door, and roadshows must be restricted to five vehicles. The narrative of this election, then, will not be set in rallies and roadshows, but on WhatsApp and Facebook. Also read: ‘It’s a joke, discourages voting’ — Bihar MLAs upset by EC’s poll",,,bjp,anti
a10cbe07f6de835b432642f5deeeb6318ed5620abc8a781f75298b1c7fffdd55,2022-05-31,An epic contest between Ruto and Odinga,"Kenya goes to the polls on August 9, 2022, to elect the country’s fifth President, besides national lawmakers, governors and assemblies of its 47 counties. Without a doubt, Kenya’s upcoming elections will be among the most significant political events in Africa at a time when democratic governance is receding in parts of the continent. The fact that Kenya is one of Africa’s major democracies, and given its history of election-related violence, these polls are important and will be closely watched. A smooth process will consolidate democratic gains in the country and serve as a symbol for the rest of the continent. Political campaigning is in full swing and the debates mostly revolve around political dynasties, tribal power-brokers, and changing inter-ethnic alliances. Grievances about ethnic, financial, and vote-rigging corruption are existential. A close watch India is keeping a close watch on the Kenyan election because of the political, economic and cultural relationships forged between the two countries over a considerable period of time. The visit of India’s External Affairs Minister to Kenya during the pandemic only underscored the importance that India places on strengthening ties with this crucial East African neighbour. For a maritime country and a regional powerhouse such as",ministry of external affairs,,,neutral
49a834a6b46f304dd15e6b28874abd61e8e6bdcf57bccf2c948e1e5bdacd1bee,2024-01-24,Ram Mandir and Bharat Jodo 2.0: Both are Election Pitches for Swing States,"Whether it is the consecration of the Ram Mandir in Ayodhya by Prime Minister Narendra Modi or the Bharat Jodo Nyay Yatra spearheaded by Rahul Gandhi and the Congress party, the electoral and political importance of both, albeit strikingly different in their respective optics and propriety, has a strong electoral pitch for the voters of key swing states. A potent mix of religious majoritarianism and welfarism has worked well for the BJP in states like UP (that are electorally more important in national elections). On the other hand, the Congress’s Yatra 2.0 plan consists of 15 states, 110 districts, and 100 Lok Sabha seats. Back in the 2019 Lok Sabha polls, the Congress party had first spoken of bringing nyay as a cash-transfer welfare scheme for the poor which unfortunately failed to find any resonance amongst the voters.",,narendra modi,bjp,neutral
9f7543aed76f82797a9b4a78068ab8536e567342ba8a75fa69a1464fa964f558,2022-10-13,Why Tharoor should win Congress presidential poll but Kharge will,"The October 17 Congress presidential election is the party’s internal matter. So why are we talking about it? Well, it’s important that we do. Because the new president will have a role to play, from a limited but significant role to just some kind of a role, depending upon who among the two candidates wins. That role will be a factor in deciding whether India’s principal opposition party comes out of its existential crisis or slips deeper into it. advertisement Talking generally, and not necessarily with a particular election in mind, the role of a robust opposition is crucial as it decides how well any democracy functions. Principally, it determines whether bills are passed in Parliament in noisy and chaotic automation or whether Parliament passes those bills with adequate consultation. A robust opposition more effectively raises the voices of those who did not vote for the party or coalition that won, holds the government of the day to account and enforces course correction whenever necessary. The Congress should be commended for at least holding an election. It’s also a shrewd political move to blunt the BJP’s attack on the Congress over the dynasty issue. Be that as it may, the",,,bjp,neutral
57c674b84827d110d62447acc43a4bc97567e89c37c05a7cb1eb2f67e0c5edec,2022-10-21,Opinion: Rishi Sunak's Second Chance,"British politics seems to be on a loop tape. Here we are again for the second time in under four months - a Prime Minister forced to stand down after losing the confidence of Conservative Members of Parliament, and a bruising leadership contest in prospect. And while we aren't yet sure who will stand, the two leading contenders are likely to be Rishi Sunak, the former Chancellor of the Exchequer, and Boris Johnson, who may seek a sensational political comeback. This will be Rishi Sunak's second bid for the top job, and this time around, he could make it. Conservative MPs will vote on Monday and then the two front-runners will face an online poll of Conservative Party members with the result announced next Friday, October 28. Rishi Sunak has huge advantages: he has more support among Conservative Members of Parliament than any other likely contender; he had warned that Liz Truss's plans for unfunded tax cuts would lead to disaster, as has proved to be the case; and he is seen as a competent manager of the economy who enjoys the confidence of the financial markets. But the looming shadow is of Rishi Sunak's former boss, Boris Johnson, whose",,"rishi sunak, boris johnson",,neutral
ea193ff858567ba327a1a88f692c4109c6743150f060f07b6f38e47817e1e40d,2022-03-10,Exit poll predicts BJP winning more than it expected,"Predicting the minds of Uttar Pradesh voters comes with a statutory 'hazard' warning. They are wizards at practising the art of franchise and over the last few polls, they have mastered the art of disguising their final choice at the time of pressing the EVM button. After travelling in UP for almost three months, I returned with a feeling that the hunter Bharatiya Janata Party (BJP) has become the hunted. So large and diverse was the BJP's 2017 victory cake that it seemed the party was failing to stop opponents from nibbling away like rats the pieces that made the cake. There were too many negatives which voters from west to east and north to south were extremely vocal about. advertisement That’s why the Axis-My India exit poll handing over 288-326 win share to the BJP was a surprise. The exit poll showed the opposition parties like the Samajwadi Party (SP) trailing far behind with 71-101 seats and the Bahujan Samaj Party (BSP) with 3-9 seats. WATCH | Akhilesh Yadav says BJP trying to rig polls as Samajwadi Party set to win If the exit poll prediction comes true prior to Holi, UP will be awash in saffron, with other",,,bjp,anti
95b89ff55c12ca7116c42236f22d487d94845602a89a2ac3e631850fd68e1f93,2024-01-01,"BJP's third straight win in 2024 Lok Sabha polls 'almost an inevitability', writes UK columnist","Live Events (You can now subscribe to our (You can now subscribe to our Economic Times WhatsApp channel With less than six months to go for the Lok Sabha polls, a column published in UK's Guardian has predicted a hat-trick for BJP. ""In India’s current political landscape, the consensus among political analysts is that a win for Modi and the BJP is the most plausible outcome,"" writes Hannah Ellis-Petersen, citing BJP's recent wins in three state elections in Rajasthan, Madhya Pradesh and Chhattisgarh.""In the current political landscape, analysts widely agree that a Modi and BJP triumph is the most plausible outcome. Modi's popularity as a political strongman, coupled with the BJP's Hindu nationalist agenda, resonates strongly with the large Hindu majority, particularly in the populous Hindi belt of the north,"" the author writes.The author said that there exists some regional opposition to the BJP in pockets of south and east India, at the national level opposition appears fragmented and weak. About the recently formed opposition INDIA alliance, the author writes that it is yet ""to unite on crucial issues, though it vows to collectively challenge the BJP.""“The general sense is that a BJP win is almost an inevitability at this",,narendra modi,bjp,pro
1c229ea9d25c3748ecdfbd373d3059cbf4024a11e118b94d41289884e1bd606c,2021-03-23,"Opinion: Why, At 83, I Joined Mamata's Trinamool","I joined the Trinamool Congress on March 13 at its office in Kolkata. It happened rather suddenly and therefore surprised many people, including my close friends. My decision was also, as usual, rather sudden. I have acted like this throughout my life. I may take time to make up my mind, but once my mind is made up, I act swiftly. I do not summon a Panchayat before I take my decisions as some people do. So it is my decision, taken by me alone - and if it goes wrong, I have nobody to blame except myself. My disillusionment with the present BJP is well-known because I have never tried to conceal it. People often ask me why I am disillusioned with the present leadership of BJP. The reply is simple and straightforward. It is because the present BJP is poles apart from the BJP I joined decades ago. I joined the BJP led by Atal Bihari Vajpayee and LK Advani and I served it loyally until 2014 when the leadership of the party was taken over by the Modi-Shah combine. Though I was not against their leading the party and government, I had a premonition. I knew that",,"atal bihari vajpayee, lk advani, narendra modi, amit shah",bjp,anti
