id,publish_date,title,Text,central body,political figure,affiliate,Mishka Stance
aa09d76b49cf9adb6667da484f55d5ca4dc724457df5ccef42f77c5d4d7c99b4,2019-07-31,"Will NIA, instant talaq laws impact Vellore poll outcome?","This article was first published 6 years ago 'It may take the AIADMK much more convincing than already, not only to try and bring around even the one-time Muslim voters of the party. 'More importantly, the party leadership may find it even more difficult to convince traditional party voters and cadres, who had admired Jaya’s nonchalance to the party and leader ruling the Centre,' says N Sathiya Moorthy. IMAGE: Tamil Nadu Chief Minister Edappadi K Palaniswami campaigns for the AIADMK alliance candidate A C Shanmugam in Vellore. Photograph: Courtesy, Edappadi K Palaniswami on Twitter With the cancelled elections to the Vellore Lok Sabha constituency now scheduled for August 5, all eyes are on the voters, who could either reaffirm the state's poll behaviour in the general elections earlier this year, or give fresh hopes to the ‘ruling’ alliance of the BJP at the Centre and the AIADMK in Tamil Nadu, that the earlier verdict was an aberration. Fresh elections, as against ‘by-elections’ or ‘countermanded polling’, became necessary in Vellore after authorities recovered around Rs 11 crores in small bundles/parcels for ready distribution to cadres down the line. Officials declared that the seizure was made from properties identified with Dravida Munnetra",central government,,"bjp,aiadmk",neutral
ccd715c21fe0043b52cb9a6601bb6e30ce4032cbfc7ab8b6a91bc183ccfbf975,2023-07-12,Opinion: Violence no dampener as Mamata decimates Opposition in Bengal Panchayat polls,"As the ruling party in West Bengal, the Trinamool Congress had the biggest stake in getting exactly what it wanted from the West Bengal panchayat elections; taking back control over the rural base before the 2024 general elections. This has been Mamata Banerjee’s single-minded target since 2019, when the Bharatiya Janata Party won an unprecedented 18 parliamentary seats out of the total of 42 Lok Sabha seats in the state. advertisement By winning the overwhelming majority of the 3317 gram panchayats, 341 panchayat samitis and all the zilla parishads in all the 20 districts of the state, Mamata Banerjee is closer to fulfilling her vow to bleed the BJP to a point where it does not pose a challenge to the TMC’s power and consequently its dominance over West Bengal. The imperative to win and win big is a compulsion born of her focus on ensuring that the party regains most of the 34 seats it last won in 2014, if not increase the number of seats it wins in 2023. The imperative for the political players to reach the pre-determined targets was such that the level of violence spiralled. The number of people who died, 42 in pre and",,,bjp,neutral
f8bb6095b3ca3ab764d2810495737c51d90a11814219a970fd90b9dd51a58513,2021-10-25,The only way to halt the BJP juggernaut,"The stakes are high for the Bharatiya Janata Party (BJP), which has to ensure that it retains power in four (Uttar Pradesh, Uttarakhand, Goa and Manipur) of the five States which go to the polls early next year. In Punjab alone, the Congress is in power, albeit in a mess . Nature of contest This will be the first Assembly election after the second wave of COVID-19, which resulted in the loss of thousands of lives and attracted a lot of criticism of the BJP government. The ongoing farmer’s agitation and the recent incident in Lakhimpur Kheri , where four farmers were crushed to death allegedly by the son of the Union Minister of State (Home), seems to have only added trouble for the BJP. But if anyone believes that these reasons will cause the BJP’s defeat in these elections, they would be mistaken. In these four States, the BJP may not be as popular as it was during the 2017 Assembly elections, but the nature of the electoral contest could give the party an advantage. A possible multi-cornered contest in these States could result in fragmentation of anti-BJP votes, which will give the BJP an edge. The Congress will",ministry of home affairs,,bjp,anti
d8ae46ee9d1418b7f7c1b256de0d10c5e69fbf40bdd724a843994490e880187f,2020-02-12,The other Delhi is distant yet,"Being both the symbolic space that holds the reins of power over the nation-state and a geographical place that hosts millions of everyday lives, Delhi is politically split. Local elections in Delhi are neither simply provincial nor straightforwardly national. The Sufi saint Nizamuddin Auliya’s famous words, “Hunooz Dilli door ast” (Delhi is distant yet), apply to the city itself. Though they co-exist in the same city, the different avatars of Delhi can be quite far from each other. The elections to the Delhi State Assembly have underlined as never before the vast gulf between the national power centre and the regional State. Study in contrasts The Bharatiya Janata Party (BJP) contested the Delhi election as though it was an extension of the 2019 Lok Sabha campaign. The Aam Aadmi Party (AAP) fought the election as though it was about municipal matters such as water and electricity and nothing else. The Indian National Congress (INC) pretended that it was not pretending to fight the election. These contrasting styles of campaigning point to the larger challenges facing not just our polity but the very idea of India today. But before looking at the reasons why this is so, a quick look at",,,bjp,neutral
89da292c6571708baa9bf4939fdbb92734c677a76ca6c0e6038fe2e776e270fe,2024-03-16,AAP seeks to expand footprint this Lok Sabha polls: A SWOT analysis,"Live Events STRENGTHS: Arvind Kejriwal remains prominent face of party. Appeal among lower middle-class voters and AAP's pitch that it is a party with a difference. Delivery on promises of quality education and health, and free electricity and water, and other welfare schemes have yielded massive electoral successes to the party in Delhi and Punjab. Growing acceptance of AAP as a major party in national politics. WEAKNESSES: Lack of strong organisational set-up at national and state level. Absence of senior experienced leaders having wide political and strategic exposure. Dent on AAP's image as honest party over alleged corruption issues. OPPORTUNITIES: AAP has chance to create new political narrative. It has an opportunity to create big base pan-India. THREATS: Looming threat of arrest of AAP national convener Arvind Kejriwal in the now-scrapped excise policy case. 'Modi factor' which can again give BJP an edge. BJP's well-entrenched Hindutva politics. (You can now subscribe to our (You can now subscribe to our Economic Times WhatsApp channel The AAP, the ruling party in Delhi and Punjab which has achieved national party status within a span of just over a decade, will seek to expand its political footprint in the coming Lok Sabha elections .",,narendra modi,bjp,anti
a45d1ba0fd321408aaf620638d5ff9c344678808272e3b65a90ef5923ad3d193,2023-12-04,"Opinion: Forget 2023, even Lok Sabha 2024 outcome seems to be a foregone conclusion","Pundits and people who are of a certain ideological bent of mind are a die-hard lot; or you could say they are a never-say-die lot. Ordinary mortals who tremble with anger and disgust at the very mention of the name Narendra Modi would be in mourning today. The more emotional amongst them would be sharing WhatsApp texts anticipating the end of civilisation, and of the idea of India. advertisement The more level-headed amongst them would be looking closely at the numbers, wondering what electoral strategies the Congress and its INDIA partners need to adopt and execute to stop the Modi juggernaut in 2024. They are acutely aware of the fact that Jawaharlal Nehru remains the only prime minister to win three consecutive Lok Sabha mandates. They will do anything to prevent Modi (of all people) to equal that incredible record. But the die-hard lot is a different species. Even as the authors write this and even before the Election Commission has handed over certificates to victorious candidates, this lot is talking excitedly about an imminent repeat of 2003 and 2004 in 2023 and 2024. Back in December 2003, the BJP had steamrolled the Congress in assembly elections in Rajasthan, Madhya",,narendra modi,bjp,pro
2d09b906bc197c7df69a1c73e7ffd7f85f7210171b021edccd2e62adfd604093,2024-04-23,Lok Sabha Polls: Intense Heatwave Behind Low Voter Turnout,"The voter turnout, often referred to as the percentage of eligible voters turning up to exercise their franchise, has seen a decline of 4.4 percentage points in the first phase of the Lok Sabha elections, marking the first drop since the last three electoral cycles. This has sparked concern among political parties and candidates alike, as well as the Election Commission of India (ECI). In the first phase, 93 out of 102 constituencies witnessed a decline in turnout compared to 2019. Of the 40 seats won by the Bharatiya Janata Party (BJP) in that year, as many as 39 saw a drop in turnout, while among the 15 seats won by the Congress, 12 saw a reduced voting percentage. Both the ECI and the BJP have taken measures to address this decline, with the Prime Minister urging citizens, regardless of party affiliations, to actively participate in what is known as the world's largest democratic exercise. Turnout And Results Various theories have been proposed to explain this trend, but it is important to note that there is no strong correlation between turnout and electoral outcomes. An analysis spanning 16 elections from 1957 to 2019 reveals that turnout increased 10 times, with",,narendra modi,bjp,neutral
590d59eef73f0fb6593a4d7c4edc00933bc3fbd9e1ab1c5f2cc98e3330ce1d3a,2024-10-21,By-polls: Can the INDIA Bloc Keep Up Its Momentum in UP?,"All the seats except for Sisamau fell vacant after their MLAs were elected as MPs in the Lok Sabha polls. In Sisamau, SP MLA Irfan Solanki was disqualified after being convicted in a criminal case. By-polls in Milkipur, Ayodhya, have not been announced. The Election Commission has cited that there is an election petition in the High Court against SP leader Awadhesh Prasad filed by former BJP MLA Baba Gorakhnath, who lost to him in the 2022 Assembly polls. ⁠The data around assembly segment-wise leads for Uttar Pradesh in the 2024 general elections are not available yet. Of the nine Lok Sabha seats in which these nine Vidhan Sabha seats fall, the BJP won 4 seats: Ghaziabad (Ghaziabad), Phulpur (Phulpur), Kanpur (Sisamau) , Aligarh (Khair-SC). Its allies, the Apna Dal and the RLD, won the Mirzapur (Majhawan) and Bijnor (Meerapur) Lok Sabha seats respectively. The SP won Mainpuri (Karhal), Ambedkar Nagar (Katehari), and Sambhal (Kundarki). The SP and Congress alliance gained a significant chunk of the non-Yadav OBC and the non-Jatav votes in the general elections. The BJP bagged around 29 percent of the non-Jatav vote (-19 percent), 59 percent of the Other OBC vote (-13 percent), and 61 percent",,,"bjp,apna dal,rld",neutral
3d242d9201ea4df28e45d349e8d9c7930cb8208d65ae6151821b68e3ca56403c,2024-03-27,Swot analysis: Parties in dire need of Telangana Lok Sabha booster,"Revanth Reddy, K Chandrashekar Rao and G Kishan Reddy CONGRESS Strengths Potential increase in women’s votes due to welfare schemes such as free bus travel, gas cylinders for `500 & free electricity. Implementation of five of six guarantees within first 100 days despite financial constraints. Addressed unemployment actively by issuing job notifications, a significant electoral issue. Ruling party status provides political support. Emphasis on social justice in cabinet allocation. Appointment of non-corrupt officials in key positions in police department and other wings enhances credibility. Shift of minority votes to Congress due to renewed friendship with AIMIM and emerging BJP vs Congress dynamic. Growing support from Reddy community indicates political influence. Strengthening presence in South Telangana & Khammam & Warangal, promising electoral gains. Weaknesses Strong Modi image at Centre is disadvantage for Congress. Perception loss regarding potential to come to power due to weak alliances in other states. Poor performance in assembly polls in Hyderabad, Rangareddy, Medchal-Malkajgiri districts and certain BRS strongholds. Potential worsening of summer woes like drinking water problems and power issues due to election delays. Inability to fully implement all the promised welfare sops due to fund shortage. Opportunities Winning majority of Parliament seats could stabilise state govt",central government,narendra modi,bjp,neutral
371f8cf50a52e395734e4da1caf8aa838df281d359cdc2662b9c0406e16cfecc,2022-03-30,Gadkari's Congress Googly To Modi,"This article was first published 3 years ago Is anyone in the BJP listening -- to what Nitin Gadkari had to say, but possibly left unsaid? asks N Sathiya Moorthy. IMAGE: Bharatiya Janata Party supremo and Prime Minister Narendra Damodardas Modi, centre, flanked by current BJP President Jagat Prakash Nadda, left, and former BJP president and current Road Transport and Highways Minister Nitin Gadkari, right. Photograph: R Raveendran/ANI Photo In the midst of the Modi-Shah duo's continuing war cry for a 'Congress mukt Bharat' -- even after decimating it almost completely -- Union Minister Nitin Gadkari has surprised many -- particularly the 'nineties kids' and those that followed -- with his call that the nation needs the Congress. It is a bold call, which even Congress revivalists like the G-23 ginger group has forgotten, and raises questions about the logic and rationale, if any, behind Gadkari's observations. 'Democracy runs on two wheels -- the ruling dispensation and the Opposition,' Gadkari, a former president of the Bharatiya Janata Party, is reported to have told a newspaper interviewer in Pune. 'A strong Opposition is a need for democracy. Hence it is my honest wish that the Congress party should become stronger.' Preposterous","central government, ministry of road transport and highways",nitin gadkari,bjp,neutral
9df37ccdf7a42cb3161e67e86e869cacc25be67377d279e9ee929578bf0c63c5,2023-12-08,Assembly elections 2023: How BJP turned Congress’ playbook against it,"Published : Dec 08, 2023 19:02 IST - 6 MINS READ On the face of it, the Congress can console itself that it broke new ground and won Telangana and that the five Assembly contests garnered it more votes overall than it did for the BJP. The Congress got 9.5 lakh more votes in its total of 4,90,77,907 votes as against the 4,81,33,463 won by the BJP. But the Congress won one State that has 17 Lok Sabha seats while the BJP won three States that, between them, have 65 Lok Sabha seats. Although Assembly seats do not automatically translate into Lok Sabha seats, they do help maintain control over government and the bureaucracy. Since the trick of electoral politics is to best the closest rival even if they have a healthy vote share, for the BJP this is a superb result that showcases its mastery over the first-past-the-post system in the Hindi heartland. Also Read | BJP secures dominant 3-2 victory in Assembly elections, amplifies Congress’ 2024 challenges In the case of the Congress, the loss of three States (in two of which it lost sitting governments) is all the more galling as the party had actually created a",,,bjp,anti
6807252ef2c1eb476620e8c15116208425880aad68dba2e8aac862d25077c06e,2024-10-30,Don’t be Fooled by Haryana: Politics is Unclear And Economic Stress is Palpable,"This comfortable consensus got a rude shock four months later in Haryana. Once again, against the run of play and exit pollsters, a resurgent Congress, projected to win a two-thirds majority, crumbled at the finish line. The wisdom of the first hindsight now collided with the wisdom of the second hindsight. Which one was the aberration? The wisdom which thought that ennui and distress had dethroned Modi’s BJP in June? Or the wisdom which proclaimed that Modi’s BJP had gotten its mojo back in Haryana, proving that the Lok Sabha erosion was just a momentary setback? Frankly, the Haryana outcome is squarely in the grey. After getting walloped 1-9 and 0-10 in two successive general elections of 2014 and 2019, the Congress came back strongly in 2024 to level 5-5 with BJP. It gained an unbelievable swing of 18.75 percentage points, while BJP lost 11.91 percentage points out of its nearly 58 percent vote share in 2019, putting the two contenders at roughly 47 percent apiece in vote share, with the Congress’s nose a tad ahead.",,narendra modi,bjp,neutral
06c78862a1caf7d5575d33dd8409924c3cf05fb0844ae8d0662f76a2d1aaf489,2024-06-17,"Opinion: After 0/40 score in Lok Sabha Exam, AIADMK skips Vikravandi bypoll Test","The AIADMK ego is bruised after failing to open its account in the Lok Sabha elections in Tamil Nadu. Worse, the NDA secured the 2nd position in 12 constituencies, pushing the AIADMK to 3rd spot. Even more humiliating was the verdict from Kanyakumari and Puducherry, where even Seeman's NTK overtook the AIADMK, pushing it to fourth place. The immediate fallout of the 0/40 score is that the AIADMK has decided not to contest the byelection to the Vikravandi assembly constituency on July 10. The seat had become vacant after DMK legislator N Pugazhendhi's demise due to illness in April. The official reason cited by AIADMK supremo Edappadi Palaniswami is that the election won't take place in a “free and fair manner”. He alleged that the ruling party would misuse state machinery and “commit atrocities and irregularities, using money and muscle power”. He said the party had based its decision on the experience in the Erode (East) assembly bypoll in 2023 where he claimed voters had been bribed. To make it seem that he was taking a leaf from his late leader J Jayalalithaa's book, EPS pointed out how she had boycotted bypolls in constituencies like Cumbam and Bargoor in 2009",,"edappadi palaniswami, j jayalalithaa",nda,anti
31657d2516234744c31e487d3854ac1945d3ccd468e80c250d79533ec37bc2c8,2024-06-12,"An Anischit Kaal Awaits, Not Just the BJP, but Also the Opposition","A few months ahead of the Lok Sabha elections, India’s political opposition — the INDIA bloc — appeared battered, bruised, and ready to implode, lacking a clear, cohesive national-level strategy to counter the Bharatiya Janata Party (BJP). Mixed manifesto announcements were being made one after the other to seduce different vulnerable groups in the electorate, while there seemed no clear national leader or voice to take on Narendra Modi, who made this election all about 'Brand Modi'. But, as the verdict showed, the INDIA bloc, i.e., the Congress party plus its allies, against all of the odds, won an impressive 234 seats.",,narendra modi,bjp,neutral
ac711c06192dd4f0c1543148d4f4919762e0c120706521ac01192e5962d9b23e,2021-05-03,Second decisive shift,"On paper in Assam, the Congress had identified the electorate’s pain points well enough. Its manifesto promised non-implementation of the Citizenship (Amendment) Act (CAA), three million jobs in a State historically struggling with unemployment numbers, raising the daily wage of tea garden workers, free electricity up to 200 units per household and ₹2,000 monthly income support to all homemakers. An emphatic no to the CAA was meant to win back the ethnic Assamese vote that had decisively shifted to the BJP over the course of the 2014 general election and the State poll two years later. The wage sop intended to court what was once an assured party vote bank that years of silent work by the RSS and its affiliates had chipped away. A tie-up with the All India United Democratic Front (AIUDF) of Badruddin Ajmal, a prospect which the party had officially shied away from all these years, was aimed at ensuring non-fragmentation of the ‘Muslim vote’. And yet, the whole isn’t quite the same as the sum of its parts. The 10-party ‘Grand Alliance’ is only projected to win around 40 seats as the BJP-led NDA seems set to romp home a second time with a victory",,badruddin ajmal,"bjp, rss, nda",neutral
a2bef284dd35e36f3ac71d7dd19041b1fd2985506007b0f7acc8dfebcdde4d1e,2021-04-04,"Sunday View: The Best Weekend Opinion Reads, Curated Just For You","“The Madhya Pradesh chief minister, Shivraj Singh Chouhan, seems to have suddenly turned into a darling of the current Bharatiya Janata Party regime”, writes the Editorial Board of The Telegraph. From a known LK Advani loyalist, Chouhan now is seen as one of the most preferred CMs of the party leadership, and is competing with the Uttar Pradesh CM, Yogi Adityanath, in terms of canvassing for the party in the ongoing polls in five states, notes the Editorial Board.",,"shivraj singh chouhan, yogi adityanath, lk advani",bjp,neutral
7b8ebe288b14fbf1fa2695182c63a3c3c4c38b54db3437b6bf6bdb6d9fc30971,2024-06-07,In Defence of Mayawati,"In her 5 June statement, Mayawati once again reiterated that the BSP is not just a political party, It is a movement. It was forged from an extraordinary outreach, never seen before or since, by Kanshi Ram saheb. In the era of brutal caste massacres, overt endemic caste violence, and exclusion, he crisscrossed India, from urban centres to deep rural pockets. The BSP was the culmination of over a decade of groundwork and incredible sacrifices, made away from the public gaze, by tens of thousands of members of BAMCEF, DSSS and affiliated activists, workers, and cadre. At the centre of this political experiment was the idea that winning power via elections was the ultimate aim since ""power is the master key"" that opened all locks, real and proverbial, that kept the Bahujan Samaj in servitude. Getting that master key by any means (except violence) is the political philosophy of the BSP. This must be kept in mind when one looks at the BSP’s alliance strategies historically. It allied repeatedly with the BJP in the 1990s, despite the latter’s Brahmanical core, Ram Mandir movement, and opposition to Mandal Commission reforms. No one in the BSP thought that the BJP was a",,,"bjp, ram mandir movement",neutral
50619dfcec53483da01f76d716105dcef0d37ff1acaacbb69200ed65128b03fd,2024-06-06,How Modi Lost While Winning,"This article was first published 1 year ago For the first time in his political career, he failed to carry his party to even a working majority -- and again, for the first time in his career, he finds himself in a situation where he cannot rule by dictatorial fiat, points out Prem Panicker. IMAGE: Narendra D Modi greets supporters as he arrives at the Bharatiya Janata Party headquarters in New Delhi, June 4, 2024. Photograph: ANI Photo In elections, as in any other form of contest, a 'moral victory' is recorded in the fine print of history's footnotes while the narrative proper concerns itself with who won, and who lost. In historical records that future generations will read, the outcome of the 2024 general election to form the 18th Lok Sabha will be recorded thus: The National Democratic Alliance, led by the Bharatiya Janata Party, won a historic mandate for a third consecutive term in office. That is how it should be -- that is ineluctable fact, and facts admit of no buts and if-onlys. So why is it that it is the losing Opposition alliance that seems buoyant and hopeful, and the winning NDA alliance and its multitude",,narendra modi,"nda, bjp",neutral
f26b58bee9aeb950d1aec38d82e02d9fe149067a3619f54d817def06a9bbe224,2020-05-30,"Not vikas, Modi’s 2019 election was built on politics of vishwas","The overturning of historical empirical patterns on elections is straightforwardly associated with the centralisation of political power in the Modi government. This centralisation, and the extraordinary level of support for Narendra Modi and the BJP, is a natural outcome of the politics of vishwas. This is a form of personal politics in which voters prefer to centralise political power in a strong leader, and trust the leader to make good decisions for the polity – in contrast to the standard models of democratic accountability and issue-based politics, which place power in the hands of citizenry. The explicit inclusion of vishwas (trust/belief) in the slogan is telling. It is an understanding of politics that is based on the personal popularity of Modi, and the trust that voters have placed in him. One can juxtapose this trust-based conception of politics against one of ‘democratic accountability,’ wherein voters place well-defined demands on the elected representative and support him/ her based on the fulfilment of these demands. I call this accountability-based model the politics of vikas (development) because it is common to claim that politicians and leaders are judged on economic delivery. In contrast to this view of accountability-based voter behaviour in India, I",central government,narendra modi,bjp,anti
